<?xml version="1.0" encoding="UTF-8"?>
<groups xmlns="http://www.isdc.ro/wro" xmlns:xsi="http://www.w3.org/2001/XMLSchema-instance"
	xsi:schemaLocation="http://www.isdc.ro/wro wro.xsd">
	<group name="bootstrap">
		<js>webjar:bootstrap/3.3.6/js/bootstrap.min.js</js>
		<css>webjar:bootstrap/3.3.6/css/bootstrap.min.css</css>
	</group>
	<group name="jquery">
		<js>webjar:jquery/2.2.3/jquery.js</js>
	</group>
	<group name="angular">
		<js>webjar:angularjs/1.5.5/angular.js</js>
		<js>webjar:angularjs/1.5.5/angular-route.js</js>
	</group>
</groups>